{
  "case_id": "structured-trade-plan",
  "display_name": "Trade Structure Analyzer",
  "category": "analysis",
  "case_type": "trade_plan_report",
  "status": "migrated",
  "summary": "Single-symbol trade structure analysis. Computes support/resistance from rolling lows/highs, trend score from EMA alignment, ATR-based stops, then produces three risk tiers (conservative / balanced / aggressive) each with entry zone, stop, and target.",
  "source_attribution": "private-skills-for-ai-pro/must-read-intent-analysis-planning/references/usage_project_cases/structured-trade-plan",
  "core_logic": [
    "Identify recent support/resistance via rolling low/high windows.",
    "Score trend bias from EMA(20/50/200) alignment.",
    "Use ATR(14) to size three risk tiers — tight/balanced/wide.",
    "Each tier outputs entry_zone, stop_price, target_price, RR ratio.",
    "Produce a structured trade plan suitable for human review (no execution)."
  ],
  "market_bias": {
    "market_type": "futures",
    "default_symbol_scope": "user-supplied",
    "timeframes": ["1h"]
  },
  "required_features": ["close", "high", "low", "EMA", "ATR"],
  "recommended_next_step": "Display all three tiers; let user choose which to escalate to a paper-stage StrategySpec."
}
