{
  "case_id": "rsi-mean-reversion",
  "display_name": "RSI Mean Reversion",
  "category": "mean_reversion",
  "case_type": "strategy_backtest",
  "status": "migrated",
  "source_case": "private-skills-for-ai-pro-main/references/usage_project_cases/rsi-mean-reversion",
  "summary": "RSI-based oversold and overbought mean-reversion workflow with optional EMA confirmation, funding context, and staged exits.",
  "core_logic": [
    "Use RSI extremes to identify oversold and overbought states.",
    "Optionally require EMA cross confirmation for faster momentum continuation entries.",
    "Use volume and funding context as filters rather than primary alpha.",
    "Manage exits through rescans, graduated take-profit, and stop-loss controls."
  ],
  "market_bias": {
    "market_type": "futures",
    "default_symbol_scope": "USDT perpetual universe",
    "timeframes": [
      "5m",
      "15m",
      "1h"
    ]
  },
  "required_features": [
    "close",
    "volume",
    "RSI",
    "EMA cross confirmation",
    "funding regime (optional)",
    "ATR regime (optional)"
  ],
  "cyqnt_support": {
    "status": "partially_mapped",
    "current_plugins": [
      "rsi_reversion"
    ],
    "already_available_factors": [
      "RSI",
      "EMA-derived families",
      "funding rate data path"
    ],
    "gaps": [
      "multi-mode variant packaging (bottom-hunt / speed-hunt / ladder-short)",
      "native staged ladder-short semantics",
      "case-specific rescanning and graduated exits"
    ]
  },
  "recommended_next_step": "Keep this case as a packaged reference now, and add named presets plus staged short-entry behavior later if needed."
}
