{
  "case_id": "btc-multi-factor-trend",
  "display_name": "BTC Multi-Factor Trend",
  "category": "trend_following",
  "case_type": "strategy_backtest",
  "status": "migrated",
  "source_case": "private-skills-for-ai-pro-main/references/usage_project_cases/btc-multi-factor-trend",
  "summary": "BTC-focused multi-factor trend workflow that scores EMA alignment, RSI, MACD, derivatives context, ATR regime, and multi-timeframe resonance.",
  "core_logic": [
    "Use EMA alignment as the primary trend scaffold.",
    "Use RSI and MACD to confirm momentum quality rather than generate alpha alone.",
    "Use derivatives context such as funding and open interest to avoid crowded trend entries.",
    "Use ATR regime and multi-timeframe resonance to scale confidence and risk."
  ],
  "market_bias": {
    "market_type": "futures",
    "default_symbol_scope": "BTCUSDT",
    "timeframes": [
      "5m",
      "1h",
      "4h",
      "1d"
    ]
  },
  "required_features": [
    "EMA 20/60/200 alignment",
    "RSI",
    "MACD histogram",
    "funding rate",
    "open interest",
    "ATR regime",
    "multi-timeframe confirmation"
  ],
  "cyqnt_support": {
    "status": "factor_bundle",
    "current_plugins": [
      "moving_average_cross",
      "macd_trend_follow",
      "adx_trend_strength",
      "atr_breakout",
      "oi_funding_breakout",
      "multi_timeframe_ma_spread"
    ],
    "already_available_factors": [
      "MACD",
      "ADX",
      "ATR",
      "funding rate path",
      "open interest path",
      "multi-timeframe close-based features"
    ],
    "gaps": [
      "single bundled plugin with hierarchical multi-factor scoring",
      "BTC-only risk-profile presets wired into one execution path",
      "native composite verdict logic inside standard_bot"
    ]
  },
  "recommended_next_step": "Package this as a reference case now, then later build a dedicated composite plugin or orchestrator preset that combines current plugin outputs."
}
