{
  "case_id": "three-tier-strategy",
  "display_name": "Multi-Scenario Market Analysis",
  "category": "trading_advisory",
  "case_type": "trade_plan_report",
  "status": "migrated",
  "summary": "Three regime-based scenarios (conservative/balanced/aggressive) for one symbol. Each scenario carries a regime hypothesis, key factors weighted differently, and a corresponding trade plan. Designed for BTC/ETH-style high-liquidity symbols.",
  "source_attribution": "private-skills-for-ai-pro/must-read-intent-analysis-planning/references/usage_project_cases/three-tier-strategy",
  "core_logic": [
    "Compute trend (EMA20/50/200), momentum (RSI), volatility (ATR%), and structural distance (last vs rolling high/low).",
    "Conservative scenario: low leverage, only act on strong-trend regime; widest stop.",
    "Balanced scenario: standard sizing; tolerate moderate trend; ATR-based stop.",
    "Aggressive scenario: smaller stop / bigger target; depends on momentum extremes.",
    "Each scenario emits a structured plan + key factor list; user chooses one."
  ],
  "market_bias": {
    "market_type": "futures",
    "default_symbol_scope": "BTCUSDT",
    "timeframes": ["1h", "4h"]
  },
  "required_features": ["close", "high", "low", "EMA", "RSI", "ATR"],
  "recommended_next_step": "Pick a scenario consistent with your risk profile; promote to paper-stage StrategySpec."
}
