{
  "case_id": "bb-squeeze-momentum",
  "display_name": "BB Squeeze Momentum",
  "category": "volatility_breakout",
  "case_type": "strategy_backtest",
  "status": "migrated",
  "source_case": "private-skills-for-ai-pro-main/references/usage_project_cases/bb-squeeze-momentum",
  "summary": "Bollinger squeeze breakout workflow with MACD confirmation, StochRSI timing, ADX filter, and volume confirmation.",
  "core_logic": [
    "Detect Bollinger bandwidth contraction and wait for squeeze expansion.",
    "Use MACD histogram direction to validate breakout momentum.",
    "Use a timing oscillator such as StochRSI to refine entry timing.",
    "Gate trades with ADX and volume confirmation."
  ],
  "market_bias": {
    "market_type": "futures",
    "default_symbol_scope": "USDT perpetual universe",
    "timeframes": [
      "5m",
      "15m",
      "1h"
    ]
  },
  "required_features": [
    "Bollinger bands",
    "Bollinger bandwidth or squeeze state",
    "MACD",
    "ADX",
    "volume surge detection",
    "StochRSI timing"
  ],
  "cyqnt_support": {
    "status": "partially_mapped",
    "current_plugins": [
      "bollinger_mean_reversion",
      "macd_trend_follow",
      "adx_trend_strength"
    ],
    "already_available_factors": [
      "Bollinger levels",
      "MACD",
      "ADX",
      "volume series"
    ],
    "gaps": [
      "explicit squeeze-state / bandwidth breakout logic",
      "StochRSI feature family",
      "native volume surge scoring"
    ]
  },
  "recommended_next_step": "Use this packaged case to drive a future dedicated squeeze plugin, or treat it as a factor bundle layered on top of existing Bollinger, MACD, and ADX signals."
}
